IE_XML_ID;IE_NAME;IE_ID;IE_ACTIVE;IE_ACTIVE_FROM;IE_ACTIVE_TO;IE_PREVIEW_PICTURE;IE_PREVIEW_TEXT;IE_PREVIEW_TEXT_TYPE;IE_DETAIL_PICTURE;IE_DETAIL_TEXT;IE_DETAIL_TEXT_TYPE;IE_CODE;IE_SORT;IE_TAGS;IP_PROP26;IP_PROP13;IP_PROP24;IC_GROUP0;IC_GROUP1;IC_GROUP2
41;Каталоги;41;Y;;;/upload/iblock/ae1/katalog.jpg;;text;/upload/iblock/28f/Без названия (6).png;Многие современные бизнесмены, будь то индивидуальные предприниматели или же владельцы крупных компаний, вынуждены, хотя бы изредка, прибегать к услугам печати. Сфера интересов таких людей невероятно широка, однако статистически существуют более и менее востребованные полиграфические услуги. Разработка дизайна, вёрстка и печать каталогов были востребованы всегда. Но почему? Откуда спрос на такой вид печатной продукции, как каталоги? Доподлинно сказать невозможно. Скорее всего, такая любовь к каталогам связана с общечеловеческим желанием упорядочить всё, что только можно упорядочить. А может, причины кроются совершенно в другом. Тем не менее, факт остаётся фактом: каталоги были, есть и будут популярны. Главной функцией каталога, пожалуй, можно считать информационную. Передача информации о продукте или услуге – то, ради чего создаётся любой каталог. Однако для того, чтобы добиться максимального эффекта, нужно не просто передать информацию, но и сделать это правильно. Каталог позволяет проинформировать потенциального клиента о продукте или услуге достаточно наглядно. Львиная доля современных каталогов снабжена иллюстрациями, а также дополнительным комментарием касательно продукта. К тому же информация о продуктах упорядочена и представлена либо в алфавитном, либо каком-либо ином доступном, интуитивно понятном порядке. Такой подход к размещению данных позволяет усваивать информацию намного лучше, а также значительно ускоряет процесс поиска нужного продукта.;text;katalogi;500;;ПЕШТА - Заказать каталоги в Ижевске. Изготовление каталогов;Нет;;Маркетинговые материалы;;
42;Брошюры;42;Y;;;/upload/iblock/c91/broschure2.jpg;;text;/upload/iblock/646/Без названия (5).png;"Основной функцией брошюр является информирование потребителя о компании, фирме, товарах, услугах, различных программах. В них обычно нет ярко выраженных призывов, как в другой рекламной продукции, но возможны и исключения.

Прежде, чем заказывать этот вид печатного изделия, клиенту важно четко понимать, для чего нужны брошюры именно его бизнесу. Если они будут использоваться в качестве методичек, инструкций, паспорта какого-либо технического изделия, то не обязательно делать их красочными, достаточно разместить черно-белые иллюстрации или схемы.

Этот вид полиграфии активно используют государственные и муниципальные организации, учреждения медицины, образования, благотворительные фонды для информирования граждан о важных событиях. Частные предприниматели и крупные бизнесмены распространяют эту рекламную продукцию, чтобы привлечь к себе внимание клиентов.";text;broshyury;500;;ПЕШТА - Заказать брошюры в Ижевске. Изготовление брошюр;Нет;;Маркетинговые материалы;;
43;Буклеты;43;Y;;;/upload/iblock/aee/broschure.jpg;;text;/upload/iblock/f22/Без названия (4).png;"В свете этого вопрос «Зачем нужны буклеты?» выглядит наивно. Буклет – это возможность с минимальными затратами донести для потенциального клиента максимум информации. Относительная дешевизна буклетов для заказчика предопределена отличительной особенностью этого вида рекламной полиграфической продукции. Буклет не предполагает «сшивки». Его странички «обосабливаются» путем складывания. В зависимости от количества страниц, буклет может иметь вид «распашонки», «гармошки» или более сложной по складыванию конструкции.
Большой популярностью буклеты пользуются в туристической индустрии и в области культуры. Хорошим тоном считается предварять выставки, биеннале и вернисажи выпуском иллюстрированных «просветительских» буклетов.";text;buklety;500;;ПЕШТА - Заказать буклеты в Ижевске. Изготовление буклетов;Нет;;Маркетинговые материалы;;
44;Портфолио компании;44;Y;;;/upload/iblock/766/katalog2.jpg;;text;/upload/iblock/476/Без названия (3).png;"Каждому потенциальному клиенту необходимо видеть опыт работы Вашей компании или Ваш личный, если вы работаете в индивидуальном режиме. Чем выше опыт работы и знаменательней результаты вашей деятельности, тем больше шансов доказать свою компетентность, вызвать доверие клиента и получить от него заказ. Главное, подойти к этому процессу серьезно, самокритично и постараться представить в выгодном свете свои самые лучшие и сильные стороны.

Буклет – один из самых эффективных инструментов позиционирования фирмы, ее товаров и услуг, а также информирования о подробностях мероприятия или акции. Буклет позволяет сочетать значительный объем структурированной информации с красочным креативным оформление.";text;portfolio-kompanii;500;;ПЕШТА - Заказать портфолио компании в Ижевске. Изготовление портфолио для компании;Нет;;Маркетинговые материалы;;
45;Листовки;45;Y;;;/upload/iblock/afe/flyers.jpg;;text;/upload/iblock/106/Без названия (2).png;"Привлечение клиентов с помощью листовок приносит, как правило, весьма ощутимый эффект при малых затратах на рекламу. Возможно именно поэтому среди многообразия рекламной продукции, такой популярностью пользуются листовки.
Листовка содержит информацию о новой компании или о предстоящих акциях и распродажах, скидках или новых товарах и т.д. Несмотря на кажущуюся  простоту и низкую стоимость, она вполне способна стать эффективным рекламоносителем. Просто для того, чтобы добиться эффективной работы листовки, надо уделить ей не меньше внимания, чем столь популярному буклету или рекламной брошюре, а именно, разработать нестандартный дизайн и обеспечить высокое качество изготовления.";text;listovki;500;;ПЕШТА - Заказать листовки в Ижевске. Изготовление листовок;Нет;;Маркетинговые материалы;;
46;Плакаты;46;Y;;;/upload/iblock/608/poster.png;;text;/upload/iblock/b4f/Без названия (1).png;Плакаты и постеры – это одна из самых популярных ниш среди всех видов печатной продукции. Она должна быть яркой, завлекающей, бросаться в глаза и призывать к действию.  Они являются основным направлением в рекламном бизнесе. «Вкусно» изложенная информация на красочном постере произведет максимальный эффект у потребителей, а следовательно, увеличится количество клиентов рекламируемой услуги. Извещение, которое было опубликовано на плакате, должно быть зафиксировано в памяти человека для того, чтобы в скором времени он им воспользовался. На самом деле эта задача не из легких и именно поэтому следует обратиться к опытным специалистам.;text;plakaty;500;;ПЕШТА - Заказать плакаты в Ижевске. Изготовление плакатов;Нет;;Маркетинговые материалы;;
47;Приглашения;47;Y;;;/upload/iblock/93b/invite.jpg;;text;/upload/iblock/7b5/Без названия.png;"Приглашение официального лица на мероприятие дело крайне ответственное, настолько, что от него зависит исход самого события.
В деловых отношениях письмо-приглашение является важным элементом возведения доверительных и уважительных отношений двух сторон. Письменное предложение принять участие, посетить, посмотреть – это знак особого внимания, кроме того, позволяет адресату не забыть о важном событии, его ожидающем.
Свадьба, выпускной, важное мероприятие – пригласите близких Вам людей оригинальным путем, заказав приглашение у нас.";text;priglasheniya;500;;ПЕШТА - Заказать приглашения в Ижевске. Изготовление приглашений;Нет;;Маркетинговые материалы;;
48;Подарочные сертификаты;48;Y;;;/upload/iblock/0d1/nagrada.jpg;;text;/upload/iblock/b75/nagrada.jpg;"Подарочный сертификат – стильная и более оригинальная замена денег в конверте, которые часто используют, если не знают, что подарить. Сертификаты выбирают в подарок близким, друзьям и коллегам.
Визуальное оформление подарочного сертификата так же важно, как и содержание. Поскольку изделие выступает частью брендинга компании, в оформлении должен прослеживаться корпоративный стиль компании, магазина и пр. Для этого в дизайне необходимо отразить:

- Логотип;
- Шрифты и графические элементы;
- Корпоративные цвета компании.

При оформлении сертификата в корпоративном стиле компании вы дополнительно сможете повысить узнаваемость бренда, поскольку получатель, возможно, ни разу не был вашим клиентом. Дизайн сертификатов с разным номиналом может быть одинаковым. Чтобы различать их между собой, можно использовать разные цвета. Сертификат с определенным номиналом будет иметь свой цвет. Если вашим клиентом может быть и мужчина, и женщина, можно предусмотреть разницу в цвете в зависимости от полу получателя.
";text;podarochnye-sertifikaty;500;;ПЕШТА - Заказать подарочные сертификаты в Ижевске. Изготовление подарочных сертификатов;Нет;;Маркетинговые материалы;;
49;Дисконтные карты;49;Y;;;/upload/iblock/6c3/2019-07-16-nar5g1_1000x0_921.png;;text;/upload/iblock/6d1/2019-07-16-nar5g1_1000x0_921.png;"Дисконтные карты – это, несомненно, один из самых простых и доступных способов привлечь клиента в ваш магазин, превратить его в постоянного покупателя. Зная, что при следующей покупке его ждут скидки и приятные бонусы, он обязательно придет к вам снова.

Системы скидок бывают разными и напрямую зависят от продаваемых вами продуктов или предоставляемых услуг, среднего чека, сезонного характера товара, целевой аудитории и т.д. Вам необходимо продумать вашу политику скидок, сформулировать правила получения, подготовить бухгалтерию и… напечатать первый тираж дисконтных карт, которые вы будете вручать вашим клиентам. 

Дисконтная карта должна быть символом вашего фирменного стиля, бросаться в глаза, быть удобной, компактной, прочной. 
";text;diskontnye-karty;500;;ПЕШТА - Заказать дисконтные карты в Ижевске;Нет;;Маркетинговые материалы;;
50;Картонные коробки;50;Y;;;/upload/iblock/14f/korobka.jpg;;text;/upload/iblock/c99/Без названия (13).png;"Экологический подход к ведению бизнеса превратился из причудливой новинки в обязательное требование. Чтобы завоевать современных покупателей, компании должны проявлять заботу о природе.

Со временем пластика стало так много, что возникли сложности с его утилизацией. В естественных условиях пластик разлагается сотни лет. Искусственная утилизация требует большого количества ресурсов. Массовое накопление отходов, сложности с хранением и утилизацией мусора привели к поиску новых решений.

Постепенно наше общество стало более осознанным. Клиенты стали понимать вред пластикового мусора. И крупным компаниям пришлось подстроиться под требования общества, чтобы улучшить репутацию своих брендов. Забота об экологии стала конкурентным преимуществом компании на рынке.";text;kartonnye-korobki;500;;ПЕШТА - Заказать картонные коробки в Ижевске. Изготовление картонных коробок;Нет;;Инструменты для упаковки Вашего продукта;;
51;Бумажные пакеты;51;Y;;;/upload/iblock/2e4/paket.jpg;;text;/upload/iblock/dfa/Без названия (12).png;"Бумажные пакеты с логотипом являются одной из составляющих корпоративного стиля компании. Пакеты нужны всегда, для встреч — перенос различных документов, для выставок, конференций и промо-акций — упаковка раздаточного материала для клиентов и партнеров и во многих других случаях. Бумажные пакеты для компании выполняются в фирменном стиле с обязательным нанесением логотипа.
 Бумажные пакеты с логотипом компании выполняют несколько важных задач:

- Они выступают отличной упаковкой для различных целей. Помимо переноса документов и других офисных принадлежностей, в бумажные пакеты с логотипом упаковывают подарки для клиентов и партнеров, что придает особый вид даже небольшому презенту.

- Они выполняют рекламную функцию, например, придя с корпоративным пакетом в другую компанию на встречу, потенциальные клиенты или партнеры сразу обращают внимание на все детали, и если пакет и все остальное выглядит презентабельно, то это положительно влияет на общее мнение о компании.

Бумажные пакеты, помимо своей функциональности, еще экологически чистый продукт, по сравнению с полиэтиленовыми пакетами, который не вредит окружающей среде и быстрее разлагается в природе, что очень важно.";text;bumazhnye-pakety;500;;ПЕШТА - Заказать бумажные пакеты в Ижевске. Изготовление бумажных пакетов;Нет;;Инструменты для упаковки Вашего продукта;;
52;Вкладыши в продукт;52;Y;;;/upload/iblock/d69/cards.jpg;;text;/upload/iblock/474/Без названия (11).png;Вкладыши - это разновидность этикеток, отличающиеся от них направленностью товарной информации, предназначенные для сообщения кратких сведений о наименовании товара, изготовителе (наименование организации, номер смены). Иногда вкладыши могут содержать краткую характеристику потребительских свойств товара, в первую очередь - функционального назначения. Тогда вкладыш приобретает дополнительные функции - рекламного листка или проспекта, но в отличие от них рекламная функция вкладыша не является основной, а реализуется через характеристику товара.;text;vkladyshi-v-produkt;500;;ПЕШТА - Заказать вкладыши в продукт Ижевск. Изготовление вкладышей в продукт;Нет;;Инструменты для упаковки Вашего продукта;;
53;Этикетки;53;Y;;;/upload/iblock/537/banka.jpg;;text;/upload/iblock/e44/Без названия (10).png;Потенциальные покупатели чаще всего обращают внимание на красивую упаковку и этикетку, ведь под красивым оформлением может скрываться «хороший» товар. Хотя здесь всё индивидуально. Вы когда-нибудь видели товар с этикеткой, которая не вызывает особого желания приобрести продукт, но тем не менее, продукт может быть качественней чем подобный продукт, но с «потрясающей» этикеткой и наоборот? То есть этикетка, безусловно, подсознательно и осознано может влиять на дальнейшее решение потенциального покупателя. Поэтому для успеха в продвижении продукта нужно «правильно» оформить этикетку.;text;etiketki;500;;ПЕШТА - Заказать этикетки в Ижевске. Изготовление этикеток;Нет;;Инструменты для упаковки Вашего продукта;;
54;Наклейки;54;Y;;;/upload/iblock/744/nakleyka.jpg;;text;/upload/iblock/291/Без названия (9).png;"Итак, прежде всего наклейки могут нести какую-нибудь полезную информацию. Например, вы являетесь владельцем какого-нибудь магазина и хотите устроить акцию. Для того, чтобы оповестить об этом своих потенциальных клиентов, вы можете наклеить у схода в свой магазин соответствующую наклейку. После окончания акции вам не составит труда убрать наклейку. Даже наклейки могут служить в рекламных целях. 
Также вы можете использовать наклейки в качестве своеобразного подарка для своих клиентов. Это может поспособствовать тому, что ваши клиенты станут приходить к вам снова и снова.";text;nakleyki;500;;ПЕШТА - Заказать наклейки в Ижевске. Изготовление наклеек;Нет;;Инструменты для упаковки Вашего продукта;;
