IE_XML_ID;IE_NAME;IE_ID;IE_ACTIVE;IE_ACTIVE_FROM;IE_ACTIVE_TO;IE_PREVIEW_PICTURE;IE_PREVIEW_TEXT;IE_PREVIEW_TEXT_TYPE;IE_DETAIL_PICTURE;IE_DETAIL_TEXT;IE_DETAIL_TEXT_TYPE;IE_CODE;IE_SORT;IE_TAGS;IP_PROP26;IP_PROP13;IP_PROP24;IC_GROUP0;IC_GROUP1;IC_GROUP2
71;Календари;71;Y;;;/upload/iblock/0be/calendar.jpg;;text;/upload/iblock/3c6/Без названия (31).png;"В наши дни фирменные календари стали частью корпоративной культуры предприятия. И практически все крупные компании стараются выпустить свою партию календарей перед Новогодними праздниками. Ведь оригинальный и стильный календарь с символикой предприятия - это очень эффективный и долговечный рекламоноситель, так как он целый год находится перед глазами ваших потенциальных клиентов, тем самым способствуя росту популярности предприятия.

Кто-то любит вешать календари на стену, кому-то важно, чтобы рабочий стол украшал маленький календарь домик или перекидной, а некоторые и вовсе пользуются карманными календарями. То есть, даря календарь, вы можете быть уверенны, что его не выкинут в мусорное ведро в тот же день, ведь это очень полезный подарок, который можно использовать весь последующий год.
";text;kalendari;500;;ПЕШТА - Заказать календари в Ижевске. Изготовление календарей;Нет;;Подарки корпоративные;;
72;Открытки;72;Y;;;/upload/iblock/f70/otkrytka.jpg;;text;/upload/iblock/381/Без названия (30).png;"Открытка в наше время – неотъемлемый символ любого торжества, чтобы показать внимание, уважение и заботу; чтобы написать те заветные слова, которые мы не можем сказать вслух; чтобы быть ближе с теми, которые от нас далеко живут; чтобы напоминать о нас тем, которые уже позабыли.

В открытке можно выразить миллионы своих чувств. А поводов может быть уйма: День Рожденья и Новый Год, свадьба и рождение ребенка, новоселье и крестины, 8 марта и 23 февраля, День влюбленных и Пасха, а еще куча профессиональных, семейных праздников и просто солнечных дней
";text;otkrytki;500;;ПЕШТА - Заказать открытки в Ижевске. Изготовление открыток;Нет;;Подарки корпоративные;;
73;Фото книги;73;N;;;/upload/iblock/07d/katalog2.jpg;;text;/upload/iblock/28e/Без названия (29).png;;text;foto-knigi;500;;ПЕШТА - Заказать фото книги в Ижевске. Изготовление фото книг;Нет;;Подарки корпоративные;;
74;Грамоты, благодарности;74;Y;;;/upload/iblock/c99/nagrada.jpg;;text;/upload/iblock/258/Без названия (28).png;"Грамота - наградной документ, который, в большинстве своем, предназначен для вручения на торжественных мероприятиях, по окончанию конкурсного периода. Обычно имеет яркое декоративное оформление. Подтверждает достижение определенных вершин.

Благодарность – это официальная мера поощрения. Применяется в качестве выражения признательности за поступок, выполненную работу, либо достигнутый результат. В большинстве случаев, благодарность адресуется конкретным лицам, однако может быть адресована организации. Благодарность, в отличие от грамоты, обычно несет более эмоциональный характер. Такой вид поощрения мотивирует человека к достижению новых высот в профессиональной среде, выражает признательность, например, за спонсорскую поддержку и т.д. 

И грамоты и благодарности изготавливаются как на обычной бумаге, так и на различных дизайн-бумагах. В особых случаях могут быть использованы и  другие материалы, например, металл (цвет золото, серебро). Дополнительно может быть оформление в деревянных рамках или на деревянных плакетках.

Размер грамот и благодарностей обычно имеет классический размер А4 формата. Но в последнее время все чаще используются оригинальные размеры. Все зависит от целей, пожеланий и финансовых возможностей.
";text;gramoty-blagodarnosti;500;;ПЕШТА - Заказать грамоты и благодарности в Ижевске. Изготовление грамот и благодарностей;Нет;;Подарки корпоративные;;
